{
  "schema_version": 1,
  "week": "2026-W26",
  "analysis_week": "2026-W25",
      "summary_override": {
    "total": "6:04h",
    "swim": "5200m",
    "bike": "3:17h",
    "run": "0:47h"
  },
  "days": [
    {
      "date": "2026-06-22",
      "sessions": [
        {
          "sport": "bike",
          "title": "Recovery",
          "amount": "35min",
          "duration": "35min",
          "content": [
            "35min @120-150W, sehr locker, hohe Kadenz, kein Druck"
          ]
        }
      ]
    },
    {
      "date": "2026-06-23",
      "sessions": [
        {
          "sport": "bike",
          "title": "Threshold",
          "amount": "59min",
          "duration": "59min",
          "content": [
            "5min @203W",
            "5x8min @295-305W,4x3min @100W zwischen den Intervallen",
            "2min @100W"
          ]
        },
        {
          "sport": "swim",
          "title": "Aerobic Short",
          "amount": "2500m",
          "duration": "60min",
          "content": [
            "200m Warmup",
            "10x50m Technik",
            "10x100m locker-sauber @1:48-1:55/100m,20s Pause",
            "6x100m Pull oder sauberer Kraul @1:48-1:52/100m,20s Pause",
            "200m Cooldown"
          ]
        }
      ]
    },
    {
      "date": "2026-06-24",
      "sessions": [
        {
          "sport": "run",
          "title": "Threshold",
          "amount": "47min",
          "duration": "47min",
          "content": [
            "5min Warmup locker",
            "5x6min @4:00-4:08/km,2min Trabpause",
            "2min Cooldown locker"
          ]
        }
      ]
    },
    {
      "date": "2026-06-25",
      "sessions": [
        {
          "sport": "bike",
          "title": "Threshold",
          "amount": "51min",
          "duration": "51min",
          "content": [
            "5min @203W",
            "3x12min @290-300W,2x4min @100W zwischen den Intervallen",
            "2min @100W"
          ]
        },
        {
          "sport": "swim",
          "title": "Threshold",
          "amount": "2700m",
          "duration": "60min",
          "content": [
            "200m Warmup",
            "10x50m Technik",
            "16x100m stark-sauber @1:43-1:48/100m,20s Pause",
            "4x50m locker",
            "200m Cooldown"
          ]
        }
      ]
    },
    {
      "date": "2026-06-26",
      "sessions": [
        {
          "sport": "bike",
          "title": "Threshold",
          "amount": "52min",
          "duration": "52min",
          "content": [
            "5min @203W",
            "2x20min @285-295W,5min @100W",
            "2min @100W"
          ]
        }
      ]
    },
    {
      "date": "2026-06-27",
      "sessions": []
    },
    {
      "date": "2026-06-28",
      "sessions": []
    }
  ]
}
