{
  "schema_version": 1,
  "week": "2026-W32",
  "analysis_week": "2026-W31",
  "summary_override": {
    "total": "extern + 21:10h Canyoning, Bike und Run",
    "swim": "extern",
    "bike": "0:45h",
    "run": "0:25h"
  },
  "days": [
    {
      "date": "2026-08-03",
      "sessions": [
        {
          "sport": "run",
          "title": "Easy Run",
          "amount": "4km",
          "duration": "25min",
          "content": ["25 min @6:20/km"]
        }
      ]
    },
    {
      "date": "2026-08-04",
      "sessions": [
        {
          "sport": "swim",
          "title": "Schwimmen nach externem Plan",
          "amount": "extern",
          "duration": "extern",
          "content": ["Externen Schwimmplan absolvieren."]
        }
      ]
    },
    {
      "date": "2026-08-05",
      "sessions": [
        {
          "sport": "bike",
          "title": "Kontrollierte Bikeintervalle",
          "amount": "45min",
          "duration": "45min",
          "content": ["12 min @80 W einrollen", "3 × 5 min @150 W, jeweils 4 min @80 W locker", "10 min @75 W ausrollen", "Bei schweren Beinen oder auffällig hoher Herzfrequenz: 45 min GA1 @100 W statt der Intervalle."]
        }
      ]
    },
    {
      "date": "2026-08-06",
      "sessions": [
        {
          "sport": "swim",
          "title": "Schwimmen nach externem Plan",
          "amount": "extern",
          "duration": "extern",
          "content": ["Externen Schwimmplan absolvieren."]
        }
      ]
    },
    {
      "date": "2026-08-07",
      "sessions": [
        {
          "sport": "outdoor",
          "title": "Canyoning Halbtagestour",
          "amount": "Halbtagestour",
          "duration": "4h",
          "content": ["Als relevante Outdoor- und Muskelbelastung einordnen. Kein weiteres Training."]
        }
      ]
    },
    {
      "date": "2026-08-08",
      "sessions": [
        {
          "sport": "outdoor",
          "title": "Canyoning Ganztagestour",
          "amount": "Ganztagestour",
          "duration": "8h",
          "content": ["Als relevante Outdoor- und Muskelbelastung einordnen. Kein weiteres Training."]
        }
      ]
    },
    {
      "date": "2026-08-09",
      "sessions": [
        {
          "sport": "outdoor",
          "title": "Canyoning Ganztagestour",
          "amount": "Ganztagestour",
          "duration": "8h",
          "content": ["Als relevante Outdoor- und Muskelbelastung einordnen. Kein weiteres Training."]
        }
      ]
    }
  ]
}
